{
  "domain": "finance",
  "domain_schema_version": "1.0",
  "job_type": "fixture_optimizer",
  "purpose": "research",
  "dry_run": false,
  "input_snapshot_id": "snap_01KDVDNAZ83BAMMYCEGWF33DPM",
  "configuration": {
    "domain": "finance",
    "domain_schema_version": "1.0",
    "payload": {
      "strategy": "mean_variance",
      "objective": "portfolio_optimization",
      "universe": [
        "SPY",
        "CASH"
      ],
      "risk_aversion": 2.0,
      "lookback_days": 252,
      "rebalance_frequency": "monthly",
      "constraints": {
        "long_only": true,
        "max_weight": 1.0
      },
      "fees": {
        "transaction_cost_bps": 5
      }
    },
    "synthetic": true
  },
  "evaluation_window": {
    "start": "2026-01-02",
    "end": "2026-01-09"
  },
  "idempotency_key": "client-key-0004",
  "contract_version": "1.0.0",
  "synthetic": true
}
